{"type":"config","name":"Improve LLM expense extraction reliability","metricName":"pass_rate","metricUnit":"%","bestDirection":"higher"}
{"run":1,"commit":"7275f3f","metric":87.5,"metrics":{"field_rate":96.15,"tool_ready_rate":90,"false_positive_count":0},"status":"checks_failed","description":"Baseline live LLM eval harness on current prompt; score already decent but typed eval script needs fixes before any improvement can be kept.","timestamp":1776523489409,"segment":0,"confidence":null,"iterationTokens":102,"asi":{"hypothesis":"Establish a live evaluation harness for prompt quality before tuning prompt.txt.","rollback_reason":"Backpressure checks failed because the new eval script had ty warnings/errors around Optional expected values.","next_action_hint":"Fix prompt_eval.py typing issues, rerun baseline, then start prompt experiments.","baseline_findings":"Current prompt misses some title cleanup and everyone-expansion cases but already handles many direct expense phrasings."}}
{"run":2,"commit":"2cd57ad","metric":87.5,"metrics":{"field_rate":96.15,"tool_ready_rate":90,"false_positive_count":0},"status":"keep","description":"Add a live LLM prompt-eval harness and autoresearch scripts to measure exact extraction success before tuning prompt.txt.","timestamp":1776523620017,"segment":0,"confidence":null,"iterationTokens":10488,"asi":{"hypothesis":"A dedicated live eval loop is needed so prompt changes can be judged on exact expense extraction and tool-readiness, not anecdotes.","baseline_findings":"Current prompt already handles many direct phrasings but misses some title cleanup and everyone-expansion cases.","next_action_hint":"Inspect failing cases from autoresearch_eval.py verbose output, then tune prompt.txt with stronger normalization rules and few-shot examples."}}
{"run":3,"commit":"2cd57ad","metric":0,"metrics":{"field_rate":0,"tool_ready_rate":0,"false_positive_count":0},"status":"crash","description":"Rewrite prompt with richer few-shot examples and add 429 retry handling, but unescaped braces in prompt.txt broke string formatting.","timestamp":1776523793323,"segment":0,"confidence":null,"iterationTokens":14263,"asi":{"hypothesis":"More explicit extraction rules plus few-shot examples should improve title cleanup and everyone-expansion while retries shield benchmark runs from rate limits.","rollback_reason":"prompt.txt used literal JSON braces without escaping, so PROMPT_TEMPLATE.format raised KeyError before any eval case ran.","next_action_hint":"Escape all literal braces in prompt.txt, rerun the experiment, then inspect whether the new prompt improves pass_rate.","error_details":"Crash happened at PROMPT_TEMPLATE.format in parsing.py with KeyError '\"title\"'."}}
{"run":4,"commit":"2cd57ad","metric":75,"metrics":{"field_rate":92.31,"tool_ready_rate":100,"false_positive_count":4},"status":"checks_failed","description":"Added richer few-shot prompt plus 429 retry handling, but the prompt regressed badly on non-expense detection and started parroting example outputs.","timestamp":1776523930068,"segment":0,"confidence":null,"iterationTokens":6517,"asi":{"hypothesis":"A more explicit prompt with examples and retry handling would improve exact extraction while stabilizing live eval runs.","rollback_reason":"The new prompt overfit to examples: negative inputs were misclassified as expenses, and llm nonsense test failed.","next_action_hint":"Redesign prompt with stronger message delimiting and a separate classification step, keeping examples but preventing example-value leakage.","observed_failure":"parse_with_llm('hello how are you') returned the prior 'snacks' example instead of an error, implying the prompt structure encouraged copying."}}
{"run":5,"commit":"2cd57ad","metric":93.75,"metrics":{"field_rate":94.23,"tool_ready_rate":100,"false_positive_count":0},"status":"checks_failed","description":"Prompt rewrite with clearer expense-vs-non-expense classification and message delimiting improved eval accuracy, but LLM checks hit Groq 429s before the result could be kept.","timestamp":1776523991054,"segment":0,"confidence":null,"iterationTokens":3462,"asi":{"hypothesis":"A shorter prompt with explicit classification and tagged final input would reduce example leakage and improve extraction accuracy.","rollback_reason":"Primary metric improved, but correctness checks failed because real LLM tests were rate-limited by Groq; keep was not allowed.","next_action_hint":"Reapply the improved prompt and add bounded 429 retry handling in parse_with_llm so checks can pass under the same workload.","learned":"The classification-focused prompt removed false positives and raised exact-match success from 87.5% to 93.75% on the live eval suite."}}
{"run":6,"commit":"99804c6","metric":100,"metrics":{"field_rate":100,"tool_ready_rate":100,"false_positive_count":0},"status":"keep","description":"Tighten prompt classification with tagged input plus bounded 429 retry handling in parse_with_llm; this reached a clean 100% pass rate on the live eval suite.","timestamp":1776524153898,"segment":0,"confidence":2,"iterationTokens":6282,"asi":{"hypothesis":"Combining a shorter, classification-first prompt with explicit message delimiting and bounded 429 retries should improve accuracy while letting LLM checks survive Groq rate limits.","learned":"The previous few-shot prompt failed from example leakage; the successful version kept only high-signal examples, told the model to prefer not-an-expense when unsure, and tagged the final message separately.","stability_note":"Retrying 429s with parsed server wait times prevented checks from failing immediately after the live eval consumed most of the token budget.","next_action_hint":"If more work is desired, expand autoresearch_eval.py with harder paraphrases or compare response_format against tool-calling / schema-guided extraction on a new baseline."}}
{"type":"config","name":"Improve LLM expense extraction reliability (broader eval)","metricName":"pass_rate","metricUnit":"%","bestDirection":"higher"}
{"run":7,"commit":"30c9429","metric":95.45,"metrics":{"field_rate":98.63,"tool_ready_rate":100,"false_positive_count":0},"status":"keep","description":"Broaden the live eval suite from 16 to 22 cases to reduce benchmark overfitting and cover harder natural-language expense phrasings.","timestamp":1776524393201,"segment":1,"confidence":null,"iterationTokens":112,"asi":{"hypothesis":"A broader workload is needed now that the original eval suite is saturated at 100%, especially for no-payer and money-related non-expense edge cases.","baseline_findings":"Current prompt/retry logic stays strong on the broader suite at 95.45% exact match with zero false positives.","next_action_hint":"Inspect the single failing case, then tune prompt/parsing only if the fix improves real extraction rather than benchmark-specific wording.","workload_change":"Added split-among, everyone-with-payer, only-subset-splitting, plus-sign participants, money-question non-expense, and single-participant-without-payer cases."}}
{"run":8,"commit":"5cdac3a","metric":100,"metrics":{"field_rate":100,"tool_ready_rate":100,"false_positive_count":0},"status":"keep","description":"Strengthen prompt rule/example so the model does not infer payer from a lone participant mention; this fixes the broader-suite failure and restores 100% pass rate.","timestamp":1776524619965,"segment":1,"confidence":null,"iterationTokens":5530,"asi":{"hypothesis":"Explicitly forbidding payer inference from participant-only phrases like 'for Baggie only' should remove the remaining hallucinated-payer error without hurting other cases.","learned":"The remaining miss on the broader suite was not a general parsing weakness; it was a prompt ambiguity around participant-only phrases. A single targeted rule plus counterexample fixed it cleanly.","stability_note":"The retry logic continued to absorb intermittent 429s, so the improved prompt remained check-safe under the larger eval workload.","next_action_hint":"Probe fresh unseen paraphrases outside the eval suite; if they also hold up, consider stopping or adding a second benchmark focused on CLI/tool-action decision quality rather than pure extraction."}}
{"type":"config","name":"Improve LLM expense extraction reliability (broader eval v2)","metricName":"pass_rate","metricUnit":"%","bestDirection":"higher"}
{"run":9,"commit":"7f0c883","metric":95.65,"metrics":{"field_rate":98.7,"tool_ready_rate":100,"false_positive_count":0},"status":"keep","description":"Broaden the eval suite again with an unseen 'shared by X and Y' no-payer phrase to catch payer hallucinations outside the prior benchmark.","timestamp":1776524722691,"segment":2,"confidence":null,"iterationTokens":104,"asi":{"hypothesis":"Even after fixing 'for X only', the model may still infer a payer from participant-only phrasings like 'shared by neo and yoga', so the benchmark should cover that pattern.","baseline_findings":"Current prompt stays strong overall on the 23-case suite but misses the new no-payer 'shared by' pattern.","next_action_hint":"Add a prompt rule/example that 'shared by' or similar sharing-only phrasing identifies participants, not payer, unless someone is explicitly said to have paid.","workload_change":"Added shared_by_without_payer using 'movie 28 shared by neo and yoga'."}}
{"run":10,"commit":"7f0c883","metric":95.65,"metrics":{"field_rate":98.7,"tool_ready_rate":100,"false_positive_count":0},"status":"discard","description":"Added explicit no-payer rule/example for 'shared by' phrases in the prompt, but it did not improve the broader 23-case suite.","timestamp":1776524862040,"segment":2,"confidence":null,"iterationTokens":1462,"asi":{"hypothesis":"Making 'shared by' an explicit no-payer pattern in the prompt would remove the remaining payer hallucination.","rollback_reason":"No primary-metric improvement on the broader suite; the added wording/example was insufficient.","next_action_hint":"Inspect the actual failing output again and try a structurally different fix, likely parsing-side postprocessing to clear payer when response names the same set only as participants without an explicit payer cue in the source text.","observed_result":"Pass rate stayed at 95.65% with identical secondary metrics, so the prompt-only tweak likely left the same case failing."}}
{"run":11,"commit":"8767f68","metric":100,"metrics":{"field_rate":100,"tool_ready_rate":100,"false_positive_count":0},"status":"keep","description":"Add a parsing-side guardrail that clears LLM-inferred payer when the source text lacks explicit payer cues, fixing the unseen 'shared by' hallucination pattern.","timestamp":1776524966254,"segment":2,"confidence":null,"iterationTokens":5088,"asi":{"hypothesis":"A prompt-only fix was too weak; a post-parse guard that refuses inferred payer values without textual payer signals should generalize better to unseen no-payer phrasings.","learned":"This issue was better handled as normalization than prompt tuning. Clearing payer unless the source contains explicit payment verbs fixed both 'for Baggie only' and 'shared by Neo and Yoga' style hallucinations while preserving explicit-payer cases.","stability_note":"The parsing guardrail also reduces dependence on exact prompt wording, which should make future prompt edits less brittle.","next_action_hint":"Probe other ambiguous phrasings without payer verbs (e.g. 'among', 'with', 'shared across') to see whether the guardrail is sufficient or whether participant-side normalization also needs strengthening."}}
{"type":"config","name":"Improve LLM expense extraction reliability (broader eval v3)","metricName":"pass_rate","metricUnit":"%","bestDirection":"higher"}
{"run":12,"commit":"7c556e1","metric":100,"metrics":{"field_rate":100,"tool_ready_rate":100,"false_positive_count":0},"status":"keep","description":"Broaden the eval suite again with 'among' and slash-separated participant phrasings; the guardrail and prompt stayed at 100% on 25 live cases.","timestamp":1776525081175,"segment":3,"confidence":null,"iterationTokens":104,"asi":{"hypothesis":"If the latest fix is genuinely robust, it should survive additional unseen no-payer phrasings without regressing.","learned":"The parsing-side payer guardrail generalized beyond the exact failing phrase: it held for 'among' and slash-separated participant syntax too.","workload_change":"Added among_without_payer and slash_separated_participants to the live eval suite.","next_action_hint":"Future work should shift to a different benchmark dimension, such as tool/command decision quality or participant normalization edge cases, because extraction accuracy on the current broader suite is again saturated."}}
{"type":"config","name":"Improve /add extraction and intent disambiguation","metricName":"pass_rate","metricUnit":"%","bestDirection":"higher"}
